{
  "schema": "go-cask-benchmark-v1",
  "benchmark": "BenchmarkStoreCodecHashRoundTrip",
  "generated_at": "2026-09-15T16:25:00Z",
  "statistic": "median_of_5_runs",
  "runner": {
    "platform": "windows",
    "go": "go1.27.0 windows/amd64",
    "notes": "Measured on the current local runner; not portable cross-machine claims."
  },
  "payload_sizes": [
    "64B",
    "256B",
    "1KiB",
    "8KiB",
    "64KiB",
    "1MiB"
  ],
  "codecs": [
    "json",
    "gzip",
    "zlib",
    "flate",
    "gob",
    "binary"
  ],
  "hashers": [
    "sha256",
    "sha512",
    "sha512_256"
  ],
  "winners": [
    {
      "payload": "64B",
      "codec": "binary",
      "hasher": "sha512_256",
      "ns_per_op": 1479.0,
      "mb_per_s": 43.28,
      "bytes_per_op": 2072,
      "allocs_per_op": 25
    },
    {
      "payload": "256B",
      "codec": "binary",
      "hasher": "sha256",
      "ns_per_op": 2270.0,
      "mb_per_s": 112.78,
      "bytes_per_op": 2920,
      "allocs_per_op": 28
    },
    {
      "payload": "1KiB",
      "codec": "json",
      "hasher": "sha256",
      "ns_per_op": 6533.0,
      "mb_per_s": 156.74,
      "bytes_per_op": 8553,
      "allocs_per_op": 27
    },
    {
      "payload": "8KiB",
      "codec": "binary",
      "hasher": "sha256",
      "ns_per_op": 41771.0,
      "mb_per_s": 196.12,
      "bytes_per_op": 78744,
      "allocs_per_op": 46
    },
    {
      "payload": "64KiB",
      "codec": "binary",
      "hasher": "sha512",
      "ns_per_op": 318732.0,
      "mb_per_s": 205.61,
      "bytes_per_op": 621151,
      "allocs_per_op": 58
    },
    {
      "payload": "1MiB",
      "codec": "binary",
      "hasher": "sha256",
      "ns_per_op": 3334822.0,
      "mb_per_s": 314.43,
      "bytes_per_op": 9224400,
      "allocs_per_op": 74
    }
  ],
  "rows": [
    {
      "payload": "64B",
      "codec": "json",
      "hasher": "sha256",
      "ns_per_op": 1515.0,
      "mb_per_s": 42.24,
      "bytes_per_op": 1869,
      "allocs_per_op": 21
    },
    {
      "payload": "64B",
      "codec": "json",
      "hasher": "sha512",
      "ns_per_op": 2473.0,
      "mb_per_s": 25.88,
      "bytes_per_op": 2063,
      "allocs_per_op": 21
    },
    {
      "payload": "64B",
      "codec": "json",
      "hasher": "sha512_256",
      "ns_per_op": 1837.0,
      "mb_per_s": 34.83,
      "bytes_per_op": 1966,
      "allocs_per_op": 21
    },
    {
      "payload": "64B",
      "codec": "gzip",
      "hasher": "sha256",
      "ns_per_op": 262796.0,
      "mb_per_s": 0.24,
      "bytes_per_op": 1124466,
      "allocs_per_op": 50
    },
    {
      "payload": "64B",
      "codec": "gzip",
      "hasher": "sha512",
      "ns_per_op": 215721.0,
      "mb_per_s": 0.3,
      "bytes_per_op": 1124310,
      "allocs_per_op": 50
    },
    {
      "payload": "64B",
      "codec": "gzip",
      "hasher": "sha512_256",
      "ns_per_op": 203609.0,
      "mb_per_s": 0.31,
      "bytes_per_op": 1124436,
      "allocs_per_op": 50
    },
    {
      "payload": "64B",
      "codec": "zlib",
      "hasher": "sha256",
      "ns_per_op": 291630.0,
      "mb_per_s": 0.22,
      "bytes_per_op": 1123763,
      "allocs_per_op": 52
    },
    {
      "payload": "64B",
      "codec": "zlib",
      "hasher": "sha512",
      "ns_per_op": 337146.0,
      "mb_per_s": 0.19,
      "bytes_per_op": 1124240,
      "allocs_per_op": 52
    },
    {
      "payload": "64B",
      "codec": "zlib",
      "hasher": "sha512_256",
      "ns_per_op": 307584.0,
      "mb_per_s": 0.21,
      "bytes_per_op": 1123986,
      "allocs_per_op": 52
    },
    {
      "payload": "64B",
      "codec": "flate",
      "hasher": "sha256",
      "ns_per_op": 360366.0,
      "mb_per_s": 0.18,
      "bytes_per_op": 1123693,
      "allocs_per_op": 48
    },
    {
      "payload": "64B",
      "codec": "flate",
      "hasher": "sha512",
      "ns_per_op": 399727.0,
      "mb_per_s": 0.16,
      "bytes_per_op": 1124183,
      "allocs_per_op": 48
    },
    {
      "payload": "64B",
      "codec": "flate",
      "hasher": "sha512_256",
      "ns_per_op": 386265.0,
      "mb_per_s": 0.17,
      "bytes_per_op": 1124098,
      "allocs_per_op": 48
    },
    {
      "payload": "64B",
      "codec": "gob",
      "hasher": "sha256",
      "ns_per_op": 11513.0,
      "mb_per_s": 5.56,
      "bytes_per_op": 10200,
      "allocs_per_op": 192
    },
    {
      "payload": "64B",
      "codec": "gob",
      "hasher": "sha512",
      "ns_per_op": 11053.0,
      "mb_per_s": 5.79,
      "bytes_per_op": 10392,
      "allocs_per_op": 192
    },
    {
      "payload": "64B",
      "codec": "gob",
      "hasher": "sha512_256",
      "ns_per_op": 10711.0,
      "mb_per_s": 5.98,
      "bytes_per_op": 10296,
      "allocs_per_op": 192
    },
    {
      "payload": "64B",
      "codec": "binary",
      "hasher": "sha256",
      "ns_per_op": 1544.0,
      "mb_per_s": 41.44,
      "bytes_per_op": 1976,
      "allocs_per_op": 25
    },
    {
      "payload": "64B",
      "codec": "binary",
      "hasher": "sha512",
      "ns_per_op": 1630.0,
      "mb_per_s": 39.25,
      "bytes_per_op": 2168,
      "allocs_per_op": 25
    },
    {
      "payload": "64B",
      "codec": "binary",
      "hasher": "sha512_256",
      "ns_per_op": 1479.0,
      "mb_per_s": 43.28,
      "bytes_per_op": 2072,
      "allocs_per_op": 25
    },
    {
      "payload": "256B",
      "codec": "json",
      "hasher": "sha256",
      "ns_per_op": 2301.0,
      "mb_per_s": 111.24,
      "bytes_per_op": 2447,
      "allocs_per_op": 21
    },
    {
      "payload": "256B",
      "codec": "json",
      "hasher": "sha512",
      "ns_per_op": 2688.0,
      "mb_per_s": 95.25,
      "bytes_per_op": 2640,
      "allocs_per_op": 21
    },
    {
      "payload": "256B",
      "codec": "json",
      "hasher": "sha512_256",
      "ns_per_op": 2671.0,
      "mb_per_s": 95.83,
      "bytes_per_op": 2544,
      "allocs_per_op": 21
    },
    {
      "payload": "256B",
      "codec": "gzip",
      "hasher": "sha256",
      "ns_per_op": 523868.0,
      "mb_per_s": 0.49,
      "bytes_per_op": 1125100,
      "allocs_per_op": 50
    },
    {
      "payload": "256B",
      "codec": "gzip",
      "hasher": "sha512",
      "ns_per_op": 524540.0,
      "mb_per_s": 0.49,
      "bytes_per_op": 1125476,
      "allocs_per_op": 50
    },
    {
      "payload": "256B",
      "codec": "gzip",
      "hasher": "sha512_256",
      "ns_per_op": 570669.0,
      "mb_per_s": 0.45,
      "bytes_per_op": 1125276,
      "allocs_per_op": 50
    },
    {
      "payload": "256B",
      "codec": "zlib",
      "hasher": "sha256",
      "ns_per_op": 518161.0,
      "mb_per_s": 0.49,
      "bytes_per_op": 1124908,
      "allocs_per_op": 52
    },
    {
      "payload": "256B",
      "codec": "zlib",
      "hasher": "sha512",
      "ns_per_op": 534552.0,
      "mb_per_s": 0.48,
      "bytes_per_op": 1125109,
      "allocs_per_op": 52
    },
    {
      "payload": "256B",
      "codec": "zlib",
      "hasher": "sha512_256",
      "ns_per_op": 550261.0,
      "mb_per_s": 0.47,
      "bytes_per_op": 1125120,
      "allocs_per_op": 53
    },
    {
      "payload": "256B",
      "codec": "flate",
      "hasher": "sha256",
      "ns_per_op": 470543.0,
      "mb_per_s": 0.54,
      "bytes_per_op": 1124609,
      "allocs_per_op": 48
    },
    {
      "payload": "256B",
      "codec": "flate",
      "hasher": "sha512",
      "ns_per_op": 539273.0,
      "mb_per_s": 0.47,
      "bytes_per_op": 1124736,
      "allocs_per_op": 48
    },
    {
      "payload": "256B",
      "codec": "flate",
      "hasher": "sha512_256",
      "ns_per_op": 619217.0,
      "mb_per_s": 0.41,
      "bytes_per_op": 1124906,
      "allocs_per_op": 48
    },
    {
      "payload": "256B",
      "codec": "gob",
      "hasher": "sha256",
      "ns_per_op": 11771.0,
      "mb_per_s": 21.75,
      "bytes_per_op": 11288,
      "allocs_per_op": 193
    },
    {
      "payload": "256B",
      "codec": "gob",
      "hasher": "sha512",
      "ns_per_op": 12034.0,
      "mb_per_s": 21.27,
      "bytes_per_op": 11480,
      "allocs_per_op": 193
    },
    {
      "payload": "256B",
      "codec": "gob",
      "hasher": "sha512_256",
      "ns_per_op": 12200.0,
      "mb_per_s": 20.98,
      "bytes_per_op": 11384,
      "allocs_per_op": 193
    },
    {
      "payload": "256B",
      "codec": "binary",
      "hasher": "sha256",
      "ns_per_op": 2270.0,
      "mb_per_s": 112.78,
      "bytes_per_op": 2920,
      "allocs_per_op": 28
    },
    {
      "payload": "256B",
      "codec": "binary",
      "hasher": "sha512",
      "ns_per_op": 2437.0,
      "mb_per_s": 105.05,
      "bytes_per_op": 3112,
      "allocs_per_op": 28
    },
    {
      "payload": "256B",
      "codec": "binary",
      "hasher": "sha512_256",
      "ns_per_op": 2297.0,
      "mb_per_s": 111.44,
      "bytes_per_op": 3016,
      "allocs_per_op": 28
    },
    {
      "payload": "1KiB",
      "codec": "json",
      "hasher": "sha256",
      "ns_per_op": 6533.0,
      "mb_per_s": 156.74,
      "bytes_per_op": 8553,
      "allocs_per_op": 27
    },
    {
      "payload": "1KiB",
      "codec": "json",
      "hasher": "sha512",
      "ns_per_op": 7342.0,
      "mb_per_s": 139.47,
      "bytes_per_op": 8747,
      "allocs_per_op": 27
    },
    {
      "payload": "1KiB",
      "codec": "json",
      "hasher": "sha512_256",
      "ns_per_op": 7237.0,
      "mb_per_s": 141.49,
      "bytes_per_op": 8650,
      "allocs_per_op": 27
    },
    {
      "payload": "1KiB",
      "codec": "gzip",
      "hasher": "sha256",
      "ns_per_op": 607932.0,
      "mb_per_s": 1.68,
      "bytes_per_op": 1129766,
      "allocs_per_op": 53
    },
    {
      "payload": "1KiB",
      "codec": "gzip",
      "hasher": "sha512",
      "ns_per_op": 613031.0,
      "mb_per_s": 1.67,
      "bytes_per_op": 1129727,
      "allocs_per_op": 53
    },
    {
      "payload": "1KiB",
      "codec": "gzip",
      "hasher": "sha512_256",
      "ns_per_op": 565826.0,